{
 "generated_utc": "2026-10-14T12:57:39Z",
 "asked": 171,
 "count": 31,
 "unpriced": [],
 "drops": [],
 "vanished": [],
 "unread_chains": [],
 "stale": 0,
 "by_target": {
  "base:0xee8f4ec5672f09119b96ab6fb59c27e1b7e44b61": {
   "asset": "0x833589fcd6edb6e08f4c7c32d4f71b54bda02913",
   "symbol": "USDC",
   "decimals": 6,
   "total_assets": "414479073306315",
   "amount": 414479073.306315,
   "price_usd": 0.9997105032867428,
   "price_at": 1791982612,
   "held_usd": 414359082.97687894,
   "prev_amount": 414458090.09184,
   "prev_at": "2026-10-14T09:35:20Z",
   "amount_change_pct": 0.01
  },
  "base:0x7bfa7c4f149e7415b73bdedfe609237e29cbf34a": {
   "asset": "0x833589fcd6edb6e08f4c7c32d4f71b54bda02913",
   "symbol": "USDC",
   "decimals": 6,
   "total_assets": "448724855280168",
   "amount": 448724855.280168,
   "price_usd": 0.9997105032867428,
   "price_at": 1791982612,
   "held_usd": 448594950.9094076,
   "prev_amount": 448342671.627579,
   "prev_at": "2026-10-14T09:35:20Z",
   "amount_change_pct": 0.09
  },
  "base:0xbeef010f9cb27031ad51e3333f9af9c6b1228183": {
   "asset": "0x833589fcd6edb6e08f4c7c32d4f71b54bda02913",
   "symbol": "USDC",
   "decimals": 6,
   "total_assets": "120776755085987",
   "amount": 120776755.085987,
   "price_usd": 0.9997105032867428,
   "price_at": 1791982612,
   "held_usd": 120741790.61235175,
   "prev_amount": 120798699.332241,
   "prev_at": "2026-10-14T09:35:20Z",
   "amount_change_pct": -0.02
  },
  "base:0xbeef2d50b428675a1921bc6bbf4bfb9d8cf1461a": {
   "asset": "0x833589fcd6edb6e08f4c7c32d4f71b54bda02913",
   "symbol": "USDC",
   "decimals": 6,
   "total_assets": "23472775106955",
   "amount": 23472775.106955,
   "price_usd": 0.9997105032867428,
   "price_at": 1791982612,
   "held_usd": 23465979.81571051,
   "prev_amount": 23472356.778268,
   "prev_at": "2026-10-14T09:35:20Z",
   "amount_change_pct": 0.0
  },
  "ethereum-l1:0x55555815a5595991c3a0ff119b59aef6c8b55555": {
   "asset": "0xa0b86991c6218b36c1d19d4a2e9eb0ce3606eb48",
   "symbol": "USDC",
   "decimals": 6,
   "total_assets": "545809941126333",
   "amount": 545809941.126333,
   "price_usd": 0.9997105032867428,
   "price_at": 1791982612,
   "held_usd": 545651930.9423138,
   "prev_amount": 544132729.777928,
   "prev_at": "2026-10-14T09:35:20Z",
   "amount_change_pct": 0.31
  },
  "ethereum-l1:0x94643e86aa5e38ddac6c7791c1297f4e40cd96c1": {
   "asset": "0xa0b86991c6218b36c1d19d4a2e9eb0ce3606eb48",
   "symbol": "USDC",
   "decimals": 6,
   "total_assets": "290976352446921",
   "amount": 290976352.446921,
   "price_usd": 0.9997105032867428,
   "price_at": 1791982612,
   "held_usd": 290892115.749252,
   "prev_amount": 290082215.494984,
   "prev_at": "2026-10-14T09:35:20Z",
   "amount_change_pct": 0.31
  },
  "ethereum-l1:0xbeef047a543e45807105e51a8bbefcc5950fcfba": {
   "asset": "0xdac17f958d2ee523a2206206994597c13d831ec7",
   "symbol": "USDT",
   "decimals": 6,
   "total_assets": "79864967192255",
   "amount": 79864967.192255,
   "price_usd": 0.9991740272973859,
   "price_at": 1791982612,
   "held_usd": 79799000.90945904,
   "prev_amount": 79866558.898823,
   "prev_at": "2026-10-14T09:35:20Z",
   "amount_change_pct": -0.0
  },
  "ethereum-l1:0xbeef01735c132ada46aa9aa4c54623caa92a64cb": {
   "asset": "0xa0b86991c6218b36c1d19d4a2e9eb0ce3606eb48",
   "symbol": "USDC",
   "decimals": 6,
   "total_assets": "66139217377552",
   "amount": 66139217.377552,
   "price_usd": 0.9997105032867428,
   "price_at": 1791982612,
   "held_usd": 66120070.2915038,
   "prev_amount": 66292479.057742,
   "prev_at": "2026-10-14T09:35:20Z",
   "amount_change_pct": -0.23
  },
  "ethereum-l1:0xbeef088055857739c12cd3765f20b7679def0f51": {
   "asset": "0xa0b86991c6218b36c1d19d4a2e9eb0ce3606eb48",
   "symbol": "USDC",
   "decimals": 6,
   "total_assets": "107556105347883",
   "amount": 107556105.347883,
   "price_usd": 0.9997105032867428,
   "price_at": 1791982612,
   "held_usd": 107524968.20889404,
   "prev_amount": 107565654.044153,
   "prev_at": "2026-10-14T09:35:20Z",
   "amount_change_pct": -0.01
  },
  "ethereum-l1:0xbeef0c075da5d01112ae5cf34d257074fb5ddb2f": {
   "asset": "0x5f7827fdeb7c20b443265fc2f40845b715385ff2",
   "symbol": "EURCV",
   "decimals": 18,
   "total_assets": "134337063546099201751977155",
   "amount": 134337063.54609922,
   "price_usd": 1.1141266059337853,
   "price_at": 1791982612,
   "held_usd": 149668496.65972677,
   "prev_amount": 133907027.36379473,
   "prev_at": "2026-10-14T09:35:20Z",
   "amount_change_pct": 0.32
  },
  "monad:0x32841a8511d5c2c5b253f45668780b99139e476d": {
   "asset": "0x00000000efe302beaa2b3e6e1b18d08d69a9012a",
   "symbol": "AUSD",
   "decimals": 6,
   "total_assets": "106185211948",
   "amount": 106185.211948,
   "price_usd": 0.9990002017349817,
   "price_at": 1791982612,
   "held_usd": 106079.04815732379,
   "prev_amount": 106184.688093,
   "prev_at": "2026-10-14T09:35:20Z",
   "amount_change_pct": 0.0
  },
  "monad:0xad663ac84052b52be4ed1b27ba416505e84a00bf": {
   "asset": "0x00000000efe302beaa2b3e6e1b18d08d69a9012a",
   "symbol": "AUSD",
   "decimals": 6,
   "total_assets": "10119910311495",
   "amount": 10119910.311495,
   "price_usd": 0.9990002017349817,
   "price_at": 1791982612,
   "held_usd": 10109792.442723427,
   "prev_amount": 10119705.312475,
   "prev_at": "2026-10-14T09:35:20Z",
   "amount_change_pct": 0.0
  },
  "plasma:0xa9c251f8304b1b3fc2b9e8fcae78d94eff82ac66": {
   "asset": "0xb8ce59fc3717ada4c02eadf9682a9e934f625ebb",
   "symbol": "USDT0",
   "decimals": 6,
   "total_assets": "100005387575465",
   "amount": 100005387.575465,
   "price_usd": 0.9990303708127396,
   "price_at": 1791982612,
   "held_usd": 99908419.43278854,
   "prev_amount": 100005326.962733,
   "prev_at": "2026-10-14T09:35:20Z",
   "amount_change_pct": 0.0
  },
  "plasma:0x6695c0f8706c5ace3bdf8995073179cca47926dc": {
   "asset": "0xb8ce59fc3717ada4c02eadf9682a9e934f625ebb",
   "symbol": "USDT0",
   "decimals": 6,
   "total_assets": "59362666015048",
   "amount": 59362666.015048,
   "price_usd": 0.9990303708127396,
   "price_at": 1791982612,
   "held_usd": 59305106.24144621,
   "prev_amount": 59362666.015048,
   "prev_at": "2026-10-14T09:35:20Z",
   "amount_change_pct": 0.0
  },
  "robinhood:0xbeeff033f34c046626b8d0a041844c5d1a5409dd": {
   "asset": "0x5fc5360d0400a0fd4f2af552add042d716f1d168",
   "symbol": "USDG",
   "decimals": 6,
   "total_assets": "543867910850504",
   "amount": 543867910.850504,
   "price_usd": 0.9999565836365049,
   "price_at": 1791982612,
   "held_usd": 543844298.0835932,
   "prev_amount": 544195230.810738,
   "prev_at": "2026-10-14T09:35:20Z",
   "amount_change_pct": -0.06
  },
  "robinhood:0xde770c84fe66e063336b31737cfe9790f18c4087": {
   "asset": "0x5fc5360d0400a0fd4f2af552add042d716f1d168",
   "symbol": "USDG",
   "decimals": 6,
   "total_assets": "9737484775972",
   "amount": 9737484.775972,
   "price_usd": 0.9999565836365049,
   "price_at": 1791982612,
   "held_usd": 9737062.009793438,
   "prev_amount": 9737311.135206,
   "prev_at": "2026-10-14T09:35:20Z",
   "amount_change_pct": 0.0
  },
  "robinhood:0x925f92f055edb79c42b5d45e64a1b74143b90ea0": {
   "asset": "0x5fc5360d0400a0fd4f2af552add042d716f1d168",
   "symbol": "USDG",
   "decimals": 6,
   "total_assets": "37014571726",
   "amount": 37014.571726,
   "price_usd": 0.9999565836365049,
   "price_at": 1791982612,
   "held_usd": 37012.96468789933,
   "prev_amount": 37014.571726,
   "prev_at": "2026-10-14T09:35:20Z",
   "amount_change_pct": 0.0
  },
  "robinhood:0x4472c69d299382f8847ebce4fc6ed8e295510e3e": {
   "asset": "0x5fc5360d0400a0fd4f2af552add042d716f1d168",
   "symbol": "USDG",
   "decimals": 6,
   "total_assets": "103822987627",
   "amount": 103822.987627,
   "price_usd": 0.9999565836365049,
   "price_at": 1791982612,
   "held_usd": 103818.48001043002,
   "prev_amount": 103822.987627,
   "prev_at": "2026-10-14T09:35:20Z",
   "amount_change_pct": 0.0
  },
  "robinhood:0x99347d5f70d3838763f6bddcf80304c8aa953b57": {
   "asset": "0x5fc5360d0400a0fd4f2af552add042d716f1d168",
   "symbol": "USDG",
   "decimals": 6,
   "total_assets": "1256416425486",
   "amount": 1256416.425486,
   "price_usd": 0.9999565836365049,
   "price_at": 1791982612,
   "held_usd": 1256361.8764537699,
   "prev_amount": 1270611.820668,
   "prev_at": "2026-10-14T09:35:20Z",
   "amount_change_pct": -1.12
  },
  "robinhood:0x37788ff0c1d4e45a7fe06bc7e71e0cc00121d0a8": {
   "asset": "0x5fc5360d0400a0fd4f2af552add042d716f1d168",
   "symbol": "USDG",
   "decimals": 6,
   "total_assets": "63109058711",
   "amount": 63109.058711,
   "price_usd": 0.9999565836365049,
   "price_at": 1791982612,
   "held_usd": 63106.31874516716,
   "prev_amount": 63107.45437,
   "prev_at": "2026-10-14T09:35:20Z",
   "amount_change_pct": 0.0
  },
  "robinhood:0xbeeff0fb1dc19344a87b8479dab60a2e16160737": {
   "asset": "0x5fc5360d0400a0fd4f2af552add042d716f1d168",
   "symbol": "USDG",
   "decimals": 6,
   "total_assets": "7398694",
   "amount": 7.398694,
   "price_usd": 0.9999565836365049,
   "price_at": 1791982612,
   "held_usd": 7.398372775611906,
   "prev_amount": 7.398694,
   "prev_at": "2026-10-14T09:35:20Z",
   "amount_change_pct": 0.0
  },
  "robinhood:0x026df18fbd2a7639089d0a16293383ec687a5ca1": {
   "asset": "0x5fc5360d0400a0fd4f2af552add042d716f1d168",
   "symbol": "USDG",
   "decimals": 6,
   "total_assets": "92023483176",
   "amount": 92023.483176,
   "price_usd": 0.9999565836365049,
   "price_at": 1791982612,
   "held_usd": 92019.48785100433,
   "prev_amount": 92023.477926,
   "prev_at": "2026-10-14T09:35:20Z",
   "amount_change_pct": 0.0
  },
  "robinhood:0x65dc90cd3a0bcde967c8ae6019d6790b616e78f7": {
   "asset": "0x5fc5360d0400a0fd4f2af552add042d716f1d168",
   "symbol": "USDG",
   "decimals": 6,
   "total_assets": "62923455260",
   "amount": 62923.45526,
   "price_usd": 0.9999565836365049,
   "price_at": 1791982612,
   "held_usd": 62920.72335239407,
   "prev_amount": 62923.224133,
   "prev_at": "2026-10-14T09:35:20Z",
   "amount_change_pct": 0.0
  },